Farbe;Dokumentname;Code;Gewicht;Segment;Erstellt von;Erstellt am;Kommentar;Dokumentgruppe;Fläche;Abdeckungsgrad %;Anfang;Ende
●;judenbuche;Axt;0;klar hinein und zeigte, daß hier noch vor kurzem die Axt unbarmherzig;guhl;22.05.24 16:41:02;;;69;0.07;404;404
●;judenbuche;Axt;0;einer Axt gespalten.;guhl;22.05.24 16:41:02;;;20;0.02;863;863
●;judenbuche;Axt;0;sagte er fest. -- Es war die Axt, die man in dem Schädel des;guhl;22.05.24 16:41:02;;;60;0.06;890;890
●;judenbuche;Axt;0;oben, unten, wandte sie um. »Es ist eine Axt wie andere«, sagte er dann;guhl;22.05.24 16:41:02;;;71;0.07;893;893
●;judenbuche;Axt;0;zuzuschreiben. Die Axt lag zwanzig Jahre nachher als unnützes;guhl;22.05.24 16:41:02;;;61;0.06;907;907
●;judenbuche;Axt;0;»Wo ist Eure Axt?« -- »Meine Axt? auf der Tenne.« -- »Habt Ihr einen;guhl;22.05.24 16:41:02;;;68;0.06;933;933
●;judenbuche;rock;0;roten Rocks wie Feuerflammen nachzogen.;guhl;22.05.24 16:52:29;;;39;0.04;358;358
●;judenbuche;rock;0;Jagdrock, den silbernen Wappenschild am Arm, die gespannte Büchse in der;guhl;22.05.24 16:52:29;;;72;0.07;662;662
●;judenbuche;rock;0;"Es war ein Stahlknopf seines Jagdrocks; nun war er fort.";guhl;22.05.24 16:52:29;;;56;0.05;721;721
●;judenbuche;rock;0;Friedrich stolzierte umher wie ein Hahn, im neuen himmelblauen Rock, und;guhl;22.05.24 16:52:29;;;72;0.07;1008;1008
●;judenbuche;rock;0;getreten, und nun rann das Fett schmählich die Rockschöße entlang.;guhl;22.05.24 16:52:29;;;66;0.06;1044;1044
●;judenbuche;rock;0;"ungemacht, wie er es verlassen hatte; dort hing sein guter Rock, den ihm";guhl;22.05.24 16:52:29;;;72;0.07;1563;1563
●;judenbuche;kuehe;0;seiner Mutter Kühe allein an das andere Ende des Tales, wo man ihn oft;guhl;22.05.24 16:55:20;;;70;0.07;283;283
●;judenbuche;kuehe;0;wohl nicht verbrennen. Du läßt ihn die Kühe hüten? Ebenso gut. Es ist;guhl;22.05.24 16:55:20;;;69;0.07;323;323
●;judenbuche;kuehe;0;noch nicht wieder da mit den Kühen, und den andern im Bette, dann schlaf;guhl;22.05.24 16:55:20;;;72;0.07;386;386
●;judenbuche;kuehe;0;um nach den Kühen zu schauen. Als sie wieder in die dunkle Küche trat,;guhl;22.05.24 16:55:20;;;70;0.07;435;435
●;judenbuche;kuehe;0;fort? wohin? die Kühe sind schon zu Hause. Verfluchter Junge, ich kann;guhl;22.05.24 16:55:20;;;70;0.07;447;447
●;judenbuche;kuehe;0;Hirtenbuben einsam und träumerisch hinter den Kühen herschleichend, oder;guhl;22.05.24 16:55:20;;;72;0.07;583;583
●;judenbuche;kuehe;0;Entfernung nah bei den Kühen, die, unbekümmert um die Forstgesetze,;guhl;22.05.24 16:55:20;;;67;0.06;638;638
●;judenbuche;kuehe;0;daß der Racker auf der Stelle krepierte. Seinetwegen können die Kühe mir;guhl;22.05.24 16:55:20;;;72;0.07;669;669
●;judenbuche;kuehe;0;es,« versetzte sie, »er ist schon um vier mit den Kühen heimgekommen,;guhl;22.05.24 16:55:20;;;69;0.07;781;781
●;judenbuche;kuehe;0;daß die Kühe an der Tenne die Hörner zurückzogen und Kettengeklirr und;guhl;22.05.24 16:55:20;;;70;0.07;1018;1018
●;judenbuche;kuehe;0;Kuh gestohlen, der hieß auch Fromm. Aber er ist still und nachdenklich,;guhl;22.05.24 16:56:00;;;71;0.07;310;310
●;judenbuche;kuehe;0;Kuh;guhl;22.05.24 16:56:20;;;3;0.00;334;334
●;judenbuche;aaron;0;Aaron geprügelt und ihm sechs Groschen genommen.« -- »Hat er dem Aaron;guhl;22.05.24 16:57:35;;;70;0.07;251;251
●;judenbuche;aaron;0;auch eine schöne Uhr, bis der Jude Aaron sie ihm wieder abnahm.«;guhl;22.05.24 16:57:35;;;64;0.06;1066;1066
●;judenbuche;aaron;0;Jude Aaron, ein Schlächter und gelegentlicher Althändler aus dem;guhl;22.05.24 16:57:35;;;64;0.06;1084;1084
●;judenbuche;aaron;0;des Juden Aaron, bleich wie der Tod, das Haar wild um den Kopf, von;guhl;22.05.24 16:57:35;;;67;0.06;1132;1132
●;judenbuche;aaron;0;Jude Aaron durch einen Schlag an die Schläfe mit einem stumpfen;guhl;22.05.24 16:57:35;;;63;0.06;1138;1138
●;judenbuche;aaron;0;Aaron war vor drei Tagen am Nachmittage;guhl;22.05.24 16:57:35;;;39;0.04;1142;1142
●;judenbuche;aaron;0;"Beim Juden Salomon wußte man nichts von Aaron; er war gar nicht";guhl;22.05.24 16:57:35;;;63;0.06;1149;1149
●;judenbuche;aaron;0;daß Aaron einen Handel mit ihnen im Auge hatte.;guhl;22.05.24 16:57:35;;;47;0.04;1151;1151
●;judenbuche;aaron;0;Der Gegenstand war die Buche, unter der Aarons Stab gefunden und wo der;guhl;22.05.24 16:57:35;;;71;0.07;1262;1262
●;judenbuche;aaron;0;so sehr gereue, als der Mord eines Glaubensgenossen, Aaron, den er im;guhl;22.05.24 16:57:35;;;69;0.07;1296;1296
●;judenbuche;aaron;0;Aaron ist zwar ein verbreiteter;guhl;22.05.24 16:57:35;;;31;0.03;1300;1300
●;judenbuche;friedrich;0;Friedrich Mergel, geboren 1738, war der einzige Sohn eines sogenannten;guhl;22.05.24 16:57:57;;;70;0.07;41;41
●;judenbuche;friedrich;0;In diesen Umgebungen ward Friedrich Mergel geboren, in einem Hause, das;guhl;22.05.24 16:57:57;;;71;0.07;107;107
●;judenbuche;friedrich;0;Friedrichs Vater, der alte Hermann Mergel, war in seinem;guhl;22.05.24 16:57:57;;;56;0.05;117;117
●;judenbuche;friedrich;0;Dennoch, obwohl unter einem Herzen voll Gram getragen, war Friedrich ein;guhl;22.05.24 16:57:57;;;72;0.07;164;164
●;judenbuche;friedrich;0;Friedrich stand in seinem neunten Jahre.;guhl;22.05.24 16:57:57;;;40;0.04;171;171
●;judenbuche;friedrich;0;Friedrich stand neben ihr, schon halb;guhl;22.05.24 16:57:57;;;37;0.04;178;178
●;judenbuche;friedrich;0;"Friedrich ward still; er horchte noch ein Weilchen und schlief dann ein.";guhl;22.05.24 16:57:57;;;72;0.07;197;197
●;judenbuche;friedrich;0;Friedrich, bist du wach?« -- »Ja, Mutter.« -- »Kind, bete ein;guhl;22.05.24 16:57:57;;;61;0.06;205;205
●;judenbuche;friedrich;0;Friedrich dachte an den Teufel, wie der wohl aussehen möge.;guhl;22.05.24 16:57:57;;;59;0.06;208;208
●;judenbuche;friedrich;0;Sie fuhr zum Herde, und bald darauf hörte Friedrich sie;guhl;22.05.24 16:57:57;;;55;0.05;219;219
●;judenbuche;friedrich;0;"Friedrich meinte, sie sei tot; er erhob ein fürchterliches Geschrei,";guhl;22.05.24 16:57:57;;;68;0.06;225;225
●;judenbuche;friedrich;0;Der Bruder blieb bei ihr, und Friedrich, dem bei strenger;guhl;22.05.24 16:57:57;;;57;0.05;231;231
●;judenbuche;friedrich;0;"Friedrich kam scheu heran; die Mutter war ihm ganz unheimlich geworden";guhl;22.05.24 16:57:57;;;70;0.07;245;245
●;judenbuche;friedrich;0;Friedrich hatte seinen Vater auf dem Stroh gesehen, wo er, wie man sagt,;guhl;22.05.24 16:57:57;;;72;0.07;261;261
●;judenbuche;friedrich;0;Friedrich wuchs dieses Gefühl mit den Jahren, durch das Gefühl mancher;guhl;22.05.24 16:57:57;;;70;0.07;267;267
●;judenbuche;friedrich;0;"Friedrich mußte von andern Knaben vieles darüber hören;";guhl;22.05.24 16:57:57;;;55;0.05;280;280
●;judenbuche;friedrich;0;"In der Mutter Züge kam ein heimliches, stolzes Lächeln; ihres Friedrichs";guhl;22.05.24 16:57:57;;;72;0.07;331;331
●;judenbuche;friedrich;0;"ging alles über Erwarten gut; Friedrich zeigte sich weder verstockt noch";guhl;22.05.24 16:57:57;;;72;0.07;337;337
●;judenbuche;friedrich;0;"eines feurigen Mannes, der unter dem gestohlenen Sacke büßt; Friedrich";guhl;22.05.24 16:57:57;;;70;0.07;359;359
●;judenbuche;friedrich;0;verkennen, und wie Friedrich so langsam seinem Führer nachtrat, die;guhl;22.05.24 16:57:57;;;67;0.06;365;365
●;judenbuche;friedrich;0;Friedrich.;guhl;22.05.24 16:57:57;;;10;0.01;377;377
●;judenbuche;friedrich;0;-- Friedrich schwieg.;guhl;22.05.24 16:57:57;;;21;0.02;379;379
●;judenbuche;friedrich;0;Friedrich;guhl;22.05.24 16:57:57;;;9;0.01;392;392
●;judenbuche;friedrich;0;festen Schritt des abgehärteten Wanderers, Friedrich schwankend und wie;guhl;22.05.24 16:57:57;;;71;0.07;397;397
●;judenbuche;friedrich;0;»Friedrich, kennst du den Baum?;guhl;22.05.24 16:57:57;;;31;0.03;416;416
●;judenbuche;friedrich;0;-- Friedrich;guhl;22.05.24 16:57:57;;;12;0.01;416;416
●;judenbuche;friedrich;0;Teufel gefahren war.« -- »Ohm, Ohm!« keuchte Friedrich.;guhl;22.05.24 16:57:57;;;55;0.05;420;420
●;judenbuche;friedrich;0;"-- Friedrich ließ den Arm seines Ohms los; beide legten";guhl;22.05.24 16:57:57;;;55;0.05;425;425
●;judenbuche;friedrich;0;und Friedrich kam noch immer nicht.;guhl;22.05.24 16:57:57;;;35;0.03;432;432
●;judenbuche;friedrich;0;"stand Friedrich am Herde; er hatte sich vornübergebeugt und wärmte die";guhl;22.05.24 16:57:57;;;70;0.07;436;436
●;judenbuche;friedrich;0;»Friedrich, wie gehts dem Ohm?«;guhl;22.05.24 16:57:57;;;31;0.03;441;441
●;judenbuche;friedrich;0;Friedrich, hast du das Reden verlernt?;guhl;22.05.24 16:57:57;;;38;0.04;443;443
●;judenbuche;friedrich;0;Friedrich, Friedrich!«;guhl;22.05.24 16:57:57;;;22;0.02;455;455
●;judenbuche;friedrich;0;Wohlbehagens, der an Albernheit grenzte, während in Friedrichs Zügen der;guhl;22.05.24 16:57:57;;;72;0.07;475;475
●;judenbuche;friedrich;0;»Friedrich,« sagte sie zögernd, »sag einmal --« und schwieg dann.;guhl;22.05.24 16:57:57;;;65;0.06;483;483
●;judenbuche;friedrich;0;Friedrich sah auf und wandte sich, da er nichts weiter vernahm, wieder;guhl;22.05.24 16:57:57;;;70;0.07;484;484
●;judenbuche;friedrich;0;-- Friedrich antwortete ebenso leise:;guhl;22.05.24 16:57:57;;;37;0.04;486;486
●;judenbuche;friedrich;0;Friedrich,« sagte sie, »laß den Jungen gehen, daß er seine Bestellung;guhl;22.05.24 16:57:57;;;69;0.07;497;497
●;judenbuche;friedrich;0;»Warte, Johannes,« sagte Friedrich stolz, »ich will dir mein halbes;guhl;22.05.24 16:57:57;;;67;0.06;503;503
●;judenbuche;friedrich;0;Friedrich, geh nicht mit ihm, hörst du, geht nicht;guhl;22.05.24 16:57:57;;;50;0.05;511;511
●;judenbuche;friedrich;0;antwortete Friedrich.;guhl;22.05.24 16:57:57;;;21;0.02;513;513
●;judenbuche;friedrich;0;Friedrich stand vor ihr und hatte sie schon zweimal;guhl;22.05.24 16:57:57;;;51;0.05;520;520
●;judenbuche;friedrich;0;Friedrich hob sie auf.;guhl;22.05.24 16:57:57;;;22;0.02;524;524
●;judenbuche;friedrich;0;Von dieser Zeit an war Friedrich selten mehr zu Hause.;guhl;22.05.24 16:57:57;;;54;0.05;546;546
●;judenbuche;friedrich;0;Wegbau, wobei Friedrich für einen seiner besten Arbeiter und überall;guhl;22.05.24 16:57:57;;;68;0.06;555;555
●;judenbuche;friedrich;0;In seinem achtzehnten Jahre hatte Friedrich sich bereits einen;guhl;22.05.24 16:57:57;;;62;0.06;566;566
●;judenbuche;friedrich;0;Umständen zog, da Friedrich immer mehr auf sein Äußeres verwandte und;guhl;22.05.24 16:57:57;;;69;0.07;571;571
●;judenbuche;friedrich;0;Friedrich lag im;guhl;22.05.24 16:57:57;;;16;0.02;628;628
●;judenbuche;friedrich;0;"Friedrich achtete nicht darauf; nur zuweilen, wenn das Getöse";guhl;22.05.24 16:57:57;;;61;0.06;644;644
●;judenbuche;friedrich;0;Friedrich war an;guhl;22.05.24 16:57:57;;;16;0.02;650;650
●;judenbuche;friedrich;0;»Friedrich, was war das?« fragte der zuerst Erschienene.;guhl;22.05.24 16:57:57;;;56;0.05;668;668
●;judenbuche;friedrich;0;Friedrich fort und stieß nach dem Hunde.;guhl;22.05.24 16:57:57;;;40;0.04;673;673
●;judenbuche;friedrich;0;Friedrich, stell dich nicht;guhl;22.05.24 16:57:57;;;27;0.03;673;673
●;judenbuche;friedrich;0;»Friedrich,« sagte er mit dem Ton unterdrückter;guhl;22.05.24 16:57:57;;;47;0.04;685;685
●;judenbuche;friedrich;0;Friedrich griff krampfhaft nach einem Aste.;guhl;22.05.24 16:57:57;;;43;0.04;691;691
●;judenbuche;friedrich;0;schritt dem Gebüsche zu -- »Nein, Herr,« rief Friedrich, »wenn Ihr zu;guhl;22.05.24 16:57:57;;;69;0.07;707;707
●;judenbuche;friedrich;0;Friedrich hatte die ganze;guhl;22.05.24 16:57:57;;;25;0.02;714;714
●;judenbuche;friedrich;0;Friedrichs Gesicht hatte während dieses allmählichen Verschwindens den;guhl;22.05.24 16:57:57;;;70;0.07;722;722
●;judenbuche;friedrich;0;Friedrich;guhl;22.05.24 16:57:57;;;9;0.01;728;728
●;judenbuche;friedrich;0;-- Friedrich war krank;guhl;22.05.24 16:57:57;;;22;0.02;731;731
●;judenbuche;friedrich;0;»Mutter!« rief Friedrich aus der Kammer.;guhl;22.05.24 16:57:57;;;40;0.04;740;740
●;judenbuche;friedrich;0;»Mutter!« rief Friedrich.;guhl;22.05.24 16:57:57;;;25;0.02;745;745
●;judenbuche;friedrich;0;-- Friedrich richtete sich;guhl;22.05.24 16:57:57;;;26;0.02;746;746
●;judenbuche;friedrich;0;-- Friedrich legte sich wieder hin.;guhl;22.05.24 16:57:57;;;35;0.03;748;748
●;judenbuche;friedrich;0;»Wo ist Friedrich?«;guhl;22.05.24 16:57:57;;;19;0.02;755;755
●;judenbuche;friedrich;0;Friedrich saß aufrecht im Bette, das Gesicht in die Hände gedrückt,;guhl;22.05.24 16:57:57;;;67;0.06;777;777
●;judenbuche;friedrich;0;Friedrich, wie ist dir?« sagte die;guhl;22.05.24 16:57:57;;;34;0.03;778;778
●;judenbuche;friedrich;0;-- Friedrich, Friedrich, antworte doch, soll ich;guhl;22.05.24 16:57:57;;;48;0.05;782;782
●;judenbuche;friedrich;0;Friedrich um vier zu Hause kam und nicht wieder fortging?«;guhl;22.05.24 16:57:57;;;58;0.06;789;789
●;judenbuche;friedrich;0;"Friedrich, wie ist dir?« sagte die Mutter; »hast du";guhl;22.05.24 16:57:57;;;51;0.05;796;796
●;judenbuche;friedrich;0;"»Friedrich,« stotterte er, »du sollst sogleich zum Ohm kommen; er hat";guhl;22.05.24 16:57:57;;;69;0.07;803;803
●;judenbuche;friedrich;0;-- Friedrich drehte sich gegen die;guhl;22.05.24 16:57:57;;;34;0.03;804;804
●;judenbuche;friedrich;0;Friedrich lachte höhnisch auf:;guhl;22.05.24 16:57:57;;;30;0.03;808;808
●;judenbuche;friedrich;0;"Sie ging auf einige Minuten hinaus; als sie zurückkam, war Friedrich";guhl;22.05.24 16:57:57;;;68;0.06;810;810
●;judenbuche;friedrich;0;Auftritt mit Friedrich.;guhl;22.05.24 16:57:57;;;23;0.02;842;842
●;judenbuche;friedrich;0;Friedrich ward hereingerufen.;guhl;22.05.24 16:57:57;;;29;0.03;870;870
●;judenbuche;friedrich;0;Stunden Weges von der Schlucht, in der er Friedrich um vier Uhr;guhl;22.05.24 16:57:57;;;63;0.06;878;878
●;judenbuche;friedrich;0;der Hand hinter sich und brachte etwas Blinkendes vor Friedrichs Auge.;guhl;22.05.24 16:57:57;;;70;0.07;885;885
●;judenbuche;friedrich;0;-- Friedrich sprang drei Schritt zurück.;guhl;22.05.24 16:57:57;;;40;0.04;886;886
●;judenbuche;friedrich;0;Friedrich faßte sie mit der Hand, besah sie;guhl;22.05.24 16:57:57;;;43;0.04;892;892
●;judenbuche;friedrich;0;Am nächsten Sonntage stand Friedrich sehr früh auf, um zur Beichte zu;guhl;22.05.24 16:57:57;;;69;0.07;913;913
●;judenbuche;friedrich;0;Friedrich und verhielt sich ganz still.;guhl;22.05.24 16:57:57;;;39;0.04;924;924
●;judenbuche;friedrich;0;Friedrich, wohin?« flüsterte;guhl;22.05.24 16:57:57;;;28;0.03;924;924
●;judenbuche;friedrich;0;»Das will ich«, sagte Friedrich.;guhl;22.05.24 16:57:57;;;32;0.03;927;927
●;judenbuche;friedrich;0;"Ohm, wie kommt Ihr darauf?« sagte Friedrich dann;";guhl;22.05.24 16:57:57;;;49;0.05;931;931
●;judenbuche;friedrich;0;-- Friedrich stand beklemmt und;guhl;22.05.24 16:57:57;;;31;0.03;940;940
●;judenbuche;friedrich;0;»Ich habe schwere Schuld,« seufzte Friedrich, »daß ich ihn den unrechten;guhl;22.05.24 16:57:57;;;72;0.07;943;943
●;judenbuche;friedrich;0;"Friedrich stand unschlüssig; er hörte ein leises Geräusch; die Wolken";guhl;22.05.24 16:57:57;;;69;0.07;950;950
●;judenbuche;friedrich;0;Friedrich ging an diesem Morgen nicht zur Beichte.;guhl;22.05.24 16:57:57;;;50;0.05;952;952
●;judenbuche;friedrich;0;Eindruck, den dieser Vorfall auf Friedrich gemacht, erlosch leider nur;guhl;22.05.24 16:57:57;;;70;0.07;953;953
●;judenbuche;friedrich;0;Und in Friedrich lagen;guhl;22.05.24 16:57:57;;;22;0.02;955;955
●;judenbuche;friedrich;0;"Friedrich ward desto lauter; er versäumte keine Kirchweih oder";guhl;22.05.24 16:57:57;;;62;0.06;968;968
●;judenbuche;friedrich;0;Worten war als Friedrich und immer, wenn der Stachel saß, einen Scherz;guhl;22.05.24 16:57:57;;;70;0.07;981;981
●;judenbuche;friedrich;0;daraus zu machen wußte, so war dies der einzige mit dem Friedrich ungern;guhl;22.05.24 16:57:57;;;72;0.07;982;982
●;judenbuche;friedrich;0;Friedrich stolzierte umher wie ein Hahn, im neuen himmelblauen Rock, und;guhl;22.05.24 16:57:57;;;72;0.07;1008;1008
●;judenbuche;friedrich;0;Friedrich reichte ihm den Bogen, gab durch eine;guhl;22.05.24 16:57:57;;;47;0.04;1014;1014
●;judenbuche;friedrich;0;gespielt, und Friedrich machte Sätze vor den Augen seiner Herrschaft,;guhl;22.05.24 16:57:57;;;69;0.07;1017;1017
●;judenbuche;friedrich;0;-- Friedrich machte seinen;guhl;22.05.24 16:57:57;;;26;0.02;1028;1028
●;judenbuche;friedrich;0;Was ists? was habt ihr mit unserem Johannes?« rief Friedrich;guhl;22.05.24 16:57:57;;;60;0.06;1036;1036
●;judenbuche;friedrich;0;Aber Friedrich trat vor:;guhl;22.05.24 16:57:57;;;24;0.02;1048;1048
●;judenbuche;friedrich;0;»Was hat sie gekostet?« rief Wilm Hülsmeyer, Friedrichs Nebenbuhler.;guhl;22.05.24 16:57:57;;;68;0.06;1061;1061
●;judenbuche;friedrich;0;Willst du sie bezahlen?« fragte Friedrich.;guhl;22.05.24 16:57:57;;;42;0.04;1062;1062
●;judenbuche;friedrich;0;Friedrich warf einen stolzen Blick auf ihn und griff in;guhl;22.05.24 16:57:57;;;55;0.05;1063;1063
●;judenbuche;friedrich;0;Friedrich antwortete nicht, sondern winkte stolz der ersten Violine, und;guhl;22.05.24 16:57:57;;;72;0.07;1067;1067
●;judenbuche;friedrich;0;Friedrich war nicht;guhl;22.05.24 16:57:57;;;19;0.02;1082;1082
●;judenbuche;friedrich;0;Friedrich war wie vernichtet fortgegangen und der Jude ihm gefolgt,;guhl;22.05.24 16:57:57;;;67;0.06;1088;1088
●;judenbuche;friedrich;0;-- »Der Friedrich sah so blaß aus wie ein Tuch«, sagte eine alte Frau,;guhl;22.05.24 16:57:57;;;70;0.07;1094;1094
●;judenbuche;friedrich;0;In derselben Nacht noch wurden die Schützen aufgeboten, um Friedrich zu;guhl;22.05.24 16:57:57;;;71;0.07;1168;1168
●;judenbuche;friedrich;0;Friedrich?« fragte er mit unsicherer Stimme.;guhl;22.05.24 16:57:58;;;44;0.04;1180;1180
●;judenbuche;friedrich;0;Friedrichs Kammer.;guhl;22.05.24 16:57:58;;;18;0.02;1184;1184
●;judenbuche;friedrich;0;Und wo war Friedrich?;guhl;22.05.24 16:57:58;;;21;0.02;1280;1280
●;judenbuche;friedrich;0;daß Ihr lieber Getreuer, Friedrich Mergel, den Juden mag ebensowenig;guhl;22.05.24 16:57:58;;;68;0.06;1291;1291
●;judenbuche;friedrich;0;Friedrich war hin, verschwunden, und --;guhl;22.05.24 16:57:58;;;39;0.04;1307;1307
●;judenbuche;friedrich;0;der einst mit Friedrich Mergel entflohen.;guhl;22.05.24 16:57:58;;;41;0.04;1373;1373
●;judenbuche;friedrich;0;Man fragte ihn, warum Friedrich sich denn aus dem Staube gemacht, da er;guhl;22.05.24 16:57:58;;;71;0.07;1389;1389
●;judenbuche;friedrich;0;ehemaligen Schweinehirten, der an jenem Abende Friedrichs Uhr so sehr;guhl;22.05.24 16:57:58;;;69;0.07;1408;1408
●;judenbuche;friedrich;0;Friedrich dir gesagt?« -- »Nichts, als daß wir laufen müßten, sie wären;guhl;22.05.24 16:57:58;;;71;0.07;1432;1432
●;judenbuche;friedrich;0;"»und Friedrich ein Bündelchen; so glaubte man uns.«";guhl;22.05.24 16:57:58;;;51;0.05;1448;1448
●;judenbuche;friedrich;0;nicht gewollt, aber Friedrich bestand darauf.;guhl;22.05.24 16:57:58;;;45;0.04;1450;1450
●;judenbuche;friedrich;0;"uns ziemlich gut; mir auch, weil Friedrich mich oft erinnerte und mir";guhl;22.05.24 16:57:58;;;69;0.07;1452;1452
●;judenbuche;friedrich;0;-- er deutete auf den Toten -- »war Friedrich Mergel.«;guhl;22.05.24 16:57:58;;;54;0.05;1621;1621
●;judenbuche;simon;0;Simon Semmler war ein kleiner, unruhiger, magerer Mann mit vor dem Kopf;guhl;22.05.24 16:58:18;;;71;0.07;290;290
●;judenbuche;simon;0;»Simon, bist du da?« sagte sie und zitterte, daß sie sich am Stuhle;guhl;22.05.24 16:58:18;;;67;0.06;299;299
●;judenbuche;simon;0;-- Simon betrachtete sie ernst und reichte ihr die Hand:;guhl;22.05.24 16:58:18;;;56;0.05;301;301
●;judenbuche;simon;0;»Aber ich höre, dein Junge ist schlau und gewichst«, fuhr Simon fort.;guhl;22.05.24 16:58:18;;;69;0.07;308;308
●;judenbuche;simon;0;-- Simon lachte;guhl;22.05.24 16:58:18;;;15;0.01;312;312
●;judenbuche;simon;0;gottlob! er hat gerade Glieder.« -- »Wie sieht er aus?« fuhr Simon fort.;guhl;22.05.24 16:58:18;;;72;0.07;320;320
●;judenbuche;simon;0;Er hat viel von dir, Simon, viel.«;guhl;22.05.24 16:58:18;;;34;0.03;321;321
●;judenbuche;simon;0;-- Simon lachte:;guhl;22.05.24 16:58:18;;;16;0.02;321;321
●;judenbuche;simon;0;"Simon schien dies zu überhören; er reckte den Hals zur Türe hinaus:";guhl;22.05.24 16:58:18;;;67;0.06;327;327
●;judenbuche;simon;0;blonde Locken und Simons rötliche Borsten!;guhl;22.05.24 16:58:18;;;42;0.04;332;332
●;judenbuche;simon;0;und Simons Weise war ihr heute einschüchternder vorgekommen als je.;guhl;22.05.24 16:58:18;;;67;0.06;336;336
●;judenbuche;simon;0;es denn dahin, daß nach einer halbstündigen Unterredung Simon eine Art;guhl;22.05.24 16:58:18;;;70;0.07;339;339
●;judenbuche;simon;0;Simon nickte schlau;guhl;22.05.24 16:58:18;;;19;0.02;351;351
●;judenbuche;simon;0;sah Margret den beiden nach, wie sie fortschritten, Simon voran, mit;guhl;22.05.24 16:58:18;;;68;0.06;356;356
●;judenbuche;simon;0;Simon schien;guhl;22.05.24 16:58:18;;;12;0.01;372;372
●;judenbuche;simon;0;Plötzlich fragte Simon:;guhl;22.05.24 16:58:18;;;23;0.02;374;374
●;judenbuche;simon;0;»Betet die Mutter noch so viel?« hob Simon wieder an.;guhl;22.05.24 16:58:18;;;53;0.05;382;382
●;judenbuche;simon;0;So schritten beide rüstig voran, Simon mit dem;guhl;22.05.24 16:58:18;;;46;0.04;396;396
●;judenbuche;simon;0;Simon blieb einen Augenblick stehen;guhl;22.05.24 16:58:18;;;35;0.03;410;410
●;judenbuche;simon;0;ergriff Simon plötzlich des Knaben Arm.;guhl;22.05.24 16:58:18;;;39;0.04;415;415
●;judenbuche;simon;0;»Sieh,« fuhr Simon fort, »hier haben Ohm Franz und der Hülsmeyer deinen;guhl;22.05.24 16:58:18;;;71;0.07;418;418
●;judenbuche;simon;0;Ziegelsteinen, zu denen auch Simons Haus gehörte.;guhl;22.05.24 16:58:18;;;49;0.05;428;428
●;judenbuche;simon;0;ist des Ohms Simon Schweinehirt, der eine Botschaft an den Hülsmeyer;guhl;22.05.24 16:58:18;;;68;0.06;487;487
●;judenbuche;simon;0;"Hause.« -- »Ja, aber er bekommt nichts mehr; Ohm Simon ißt um sieben";guhl;22.05.24 16:58:18;;;68;0.06;506;506
●;judenbuche;simon;0;Simon, Simon, wie willst;guhl;22.05.24 16:58:18;;;24;0.02;516;516
●;judenbuche;simon;0;»Geld vom Ohm Simon, weil ich ihm habe arbeiten;guhl;22.05.24 16:58:18;;;47;0.04;524;524
●;judenbuche;simon;0;Ich kann mir nun selber was verdienen.« -- »Geld vom Simon?;guhl;22.05.24 16:58:18;;;59;0.06;525;525
●;judenbuche;simon;0;hatte, war sie dahin gekommen, zu denken, ihr Bruder Simon könne so;guhl;22.05.24 16:58:18;;;67;0.06;540;540
●;judenbuche;simon;0;Simon schien alle;guhl;22.05.24 16:58:18;;;17;0.02;546;546
●;judenbuche;simon;0;möglich den engen Verschlag, der ihm in Simons Hause eingeräumt war.;guhl;22.05.24 16:58:18;;;68;0.06;917;917
●;judenbuche;simon;0;"die Augen suchend umher und fuhr zusammen; in der Kammertür stand Simon,";guhl;22.05.24 16:58:18;;;72;0.07;920;920
●;judenbuche;simon;0;"geh, beicht!« flüsterte Simon mit bebender Stimme; »verunehre das";guhl;22.05.24 16:58:18;;;65;0.06;946;946
●;judenbuche;simon;0;Wer zweifelt daran, daß Simon alles tat, seinen Adoptivsohn;guhl;22.05.24 16:58:18;;;59;0.06;954;954
●;judenbuche;simon;0;Ohm Simon redete selten von ihm, und dann;guhl;22.05.24 16:58:18;;;41;0.04;1282;1282
●;judenbuche;simon;0;Simon war lange;guhl;22.05.24 16:58:18;;;15;0.01;1394;1394
●;judenbuche;simon;0;Simon;guhl;22.05.24 16:58:18;;;5;0.00;1429;1429
●;judenbuche;herr von s.;0;Herr von S. war auf dem Heimwege verstimmt, die jedesmalige;guhl;22.05.24 16:59:08;;;59;0.06;1096;1096
●;judenbuche;herr von s.;0;Furchtbares Wetter!« sagte Herr von S.;guhl;22.05.24 16:59:09;;;38;0.04;1123;1123
●;judenbuche;herr von s.;0;Der Anklage bedurfte es nicht, da Herr von S. selbst Zeuge;guhl;22.05.24 16:59:09;;;58;0.06;1169;1169
●;judenbuche;herr von s.;0;der Amtsschreiber gerade abwesend war, so betrieb Herr von S. selbst;guhl;22.05.24 16:59:09;;;68;0.06;1173;1173
●;judenbuche;herr von s.;0;"Herr von S. fuhr zurück; er hatte sie";guhl;22.05.24 16:59:09;;;37;0.04;1178;1178
●;judenbuche;herr von s.;0;Herr von S. war tief erschüttert.;guhl;22.05.24 16:59:09;;;33;0.03;1196;1196
●;judenbuche;herr von s.;0;»Sie kommen immer zu spät«, sagte Herr von S. verdrießlich.;guhl;22.05.24 16:59:09;;;59;0.06;1207;1207
●;judenbuche;herr von s.;0;"Herr von S. hatte das innigste Mitleiden mit dem armen Schelm; bis zum";guhl;22.05.24 16:59:09;;;70;0.07;1488;1488
●;judenbuche;herr von s.;0;Herr von S. schüttelte mitleidig den Kopf:;guhl;22.05.24 16:59:09;;;42;0.04;1493;1493
●;judenbuche;herr von s.;0;sehr gütig, und Herr von S. unterhielt sich oft lange mit ihm über die;guhl;22.05.24 16:59:09;;;70;0.07;1503;1503
●;judenbuche;herr von s.;0;Herr von S. war in großer Unruhe.;guhl;22.05.24 16:59:09;;;33;0.03;1542;1542
●;judenbuche;johannes;0;»Da, Johannes!« sagte er und reichte ihm mit einer Gönnermiene das;guhl;22.05.24 16:59:38;;;66;0.06;465;465
●;judenbuche;johannes;0;-- Johannes warf noch;guhl;22.05.24 16:59:38;;;21;0.02;467;467
●;judenbuche;johannes;0;"meine Violine versprochen; er ist ja doch ein armes Kind; Johannes heißt";guhl;22.05.24 16:59:38;;;72;0.07;490;490
●;judenbuche;johannes;0;Johannes Niemand heißt er.;guhl;22.05.24 16:59:38;;;26;0.02;493;493
●;judenbuche;johannes;0;»Warte, Johannes,« sagte Friedrich stolz, »ich will dir mein halbes;guhl;22.05.24 16:59:38;;;67;0.06;503;503
●;judenbuche;johannes;0;"In diesem Augenblick trat Johannes Niemand in die Kammer; dünn und lang";guhl;22.05.24 16:59:38;;;71;0.07;800;800
●;judenbuche;johannes;0;"mußt aber kommen,« keuchte Johannes; »er hat gesagt, ich müßte dich";guhl;22.05.24 16:59:38;;;67;0.06;806;806
●;judenbuche;johannes;0;und war schon zur Türe hinaus mit Johannes.;guhl;22.05.24 16:59:38;;;43;0.04;813;813
